,line,start,end
1199,How could I what?,"01:17:58,080","01:17:59,127"
1200,"You said we would destroy the Avengers, make a better world.","01:17:59,400","01:18:03,767"
1201,It will be better.,"01:18:04,080","01:18:05,127"
1202,When everyone is dead?,"01:18:06,080","01:18:08,447"
1203,That is not...,"01:18:06,080","01:18:08,447"
1204,The human race will have every opportunity to improve.,"01:18:09,400","01:18:13,246"
1205,And if they don't?,"01:18:13,760","01:18:15,091"
1206,Ask Noah.,"01:18:15,280","01:18:16,406"
1207,You are a madman.,"01:18:17,600","01:18:18,647"
1208,There were more than a dozen extinctionlevel events,"01:18:18,760","01:18:22,207"
1209,before even the dinosaurs got theirs.,"01:18:22,360","01:18:25,443"
1210,"When the Earth starts to settle, God throws a stone at it.","01:18:25,560","01:18:30,129"
1211,"And, believe me, he's winding up.","01:18:30,280","01:18:32,601"
1212,We have to evolve.,"01:18:33,360","01:18:34,566"
1213,There's no room,"01:18:35,120","01:18:36,281"
1214,for the weak.,"01:18:37,120","01:18:38,246"
1215,And who decides who's weak?,"01:18:38,480","01:18:40,448"
1216,Life.,"01:18:41,320","01:18:43,049"
1217,Life always decides.,"01:18:43,680","01:18:45,489"
1218,There's incoming.,"01:18:48,440","01:18:49,487"
1219,The Quinjet. We have to move.,"01:18:50,960","01:18:54,282"
1220,That's not a problem.,"01:18:50,960","01:18:54,282"
1221,"Wait, guys!","01:19:01,280","01:19:02,281"
1222,They'll understand.,"01:19:06,320","01:19:07,606"
1223,"When they see, they'll understand.","01:19:07,920","01:19:10,048"
1224,I just need a little more time.,"01:19:10,440","01:19:13,728"
1225,Two minutes. Stay close.,"01:19:25,120","01:19:27,248"
1226,Dr Cho!,"01:19:34,440","01:19:35,441"
1227,He's uploading himself into the body.,"01:19:39,360","01:19:40,885"
1228,Where?,"01:19:41,000","01:19:42,047"
1229,The real power is inside the Cradle.,"01:19:43,840","01:19:46,411"
1230,"The gem, its power is uncontainable.","01:19:46,480","01:19:51,011"
1231,You can't just blow it up.,"01:19:51,880","01:19:53,530"
1232,You have to get the Cradle to Stark.,"01:19:54,480","01:19:56,721"
1233,"First, I have to find it.","01:19:56,840","01:19:57,887"
1234,Go.,"01:19:58,200","01:19:59,201"
1235,Did you guys copy that?,"01:19:59,560","01:20:00,800"
1236,We did.,"01:20:00,960","01:20:02,041"
1237,I got a private jet taking off across town.,"01:20:02,200","01:20:04,646"
1238,No manifest.,"01:20:05,000","01:20:06,286"
1239,That could be him.,"01:20:06,400","01:20:07,447"
1240,There. It's a truck from the lab.,"01:20:08,400","01:20:09,970"
1241,"Right above you, Cap.","01:20:10,120","01:20:11,326"
1242,On the loop by the bridge.,"01:20:11,600","01:20:13,409"
1243,It's them.,"01:20:14,000","01:20:15,001"
1244,"You got three with the Cradle, one in the cab.","01:20:15,160","01:20:16,960"
1245,I could take out the driver.,"01:20:17,720","01:20:18,840"
1246,"Negative. That truck crashes, the gem could level the city.","01:20:18,880","01:20:21,650"
1247,We need to draw out Ultron.,"01:20:22,080","01:20:23,320"
1248,"No, no, no, no.","01:20:33,040","01:20:35,088"
1249,Leave me alone!,"01:20:36,920","01:20:37,967"
1250,"Well, he's definitely unhappy.","01:20:46,600","01:20:48,284"
1251,I'm gonna try and keep him that way.,"01:20:48,440","01:20:49,930"
1252,"You're not a match for him, Cap.","01:20:50,040","01:20:51,320"
1253,"Thanks, Barton.","01:20:52,440","01:20:53,521"
1254,You know what's in that cradle?,"01:21:16,240","01:21:17,480"
1255,The power to make real change.,"01:21:18,800","01:21:20,529"
1256,And that terrifies you.,"01:21:20,640","01:21:22,051"
1257,I wouldn't call it a comfort.,"01:21:22,200","01:21:23,360"
1258,Stop it.,"01:21:26,600","01:21:27,647"
1259,"We got a window. Four, three...","01:21:38,480","01:21:41,165"
1260,Give him hell.,"01:21:41,800","01:21:42,801"
1261,I'm always picking up after you boys.,"01:21:53,760","01:21:55,240"
1262,They're heading under the overpass.,"01:21:56,840","01:21:58,490"
1263,I've got no shot.,"01:21:56,840","01:21:58,490"
1264,Which way?,"01:21:58,840","01:21:59,887"
1265,Hard right.,"01:22:00,080","01:22:01,081"
1266,Now.,"01:22:02,240","01:22:03,321"
1267,Out of the way! Coming through!,"01:22:34,200","01:22:36,487"
1268,"Sorry, coming through!","01:22:34,200","01:22:36,487"
1269,Come on!,"01:22:52,240","01:22:53,401"
1270,"Clint, can you draw out the guards?","01:22:53,880","01:22:55,325"
1271,Let's find out.,"01:22:55,440","01:22:56,487"
1272,"Beep, beep!","01:22:57,520","01:22:58,567"
1273,They're heading back towards you.,"01:23:36,040","01:23:37,610"
1274,"So whatever you're gonna do, do it now.","01:23:37,760","01:23:39,320"
1275,I'm going in.,"01:23:44,800","01:23:47,451"
1276,"Cap, can you keep him occupied?","01:23:44,800","01:23:47,451"
1277,What do you think I've been doing?,"01:23:47,600","01:23:49,489"
1278,"Okay, package is airborne.","01:24:33,080","01:24:35,208"
1279,I have a clean shot.,"01:24:35,920","01:24:37,001"
1280,Negative. I am still in the truck.,"01:24:37,440","01:24:38,805"
1281,What the hell are you...,"01:24:38,960","01:24:39,961"
1282,Just be ready.,"01:24:38,960","01:24:39,961"
1283,I'm sending the package to you.,"01:24:40,120","01:24:41,360"
1284,How do you want me to take it?,"01:24:41,840","01:24:43,040"
1285,You might wish you hadn't asked that.,"01:24:43,240","01:24:45,322"
1286,"Please, don't do this.","01:24:58,120","01:24:59,849"
1287,What choice do we have?,"01:25:00,360","01:25:01,930"
1288,I lost him!,"01:25:10,200","01:25:11,201"
1289,He's headed your way!,"01:25:11,360","01:25:12,725"
1290,"Nat, we gotta go.","01:25:17,680","01:25:18,727"
1291,Nat!,"01:25:30,040","01:25:31,849"
1292,"Cap, you see Nat?","01:25:35,880","01:25:36,881"
1293,"If you have the package, get it to Stark! Go!","01:25:37,840","01:25:40,411"
1294,Do you have eyes on Nat?,"01:25:40,720","01:25:41,881"
1295,Go!,"01:25:42,040","01:25:43,041"
1296,Damn it.,"01:25:45,040","01:25:46,041"
1297,Civilians in our path.,"01:25:46,560","01:25:47,641"
1298,Can you stop this thing?,"01:25:48,920","01:25:50,445"
1299,I'm fine.,"01:26:29,320","01:26:30,651"
1300,I just need to take a minute.,"01:26:30,760","01:26:32,444"
1301,I'm very tempted not to give you one.,"01:26:32,920","01:26:34,809"
1302,The Cradle. Did you get it?,"01:26:34,960","01:26:36,849"
1303,Stark will take care of it.,"01:26:37,040","01:26:38,530"
1304,"No, he won't.","01:26:39,920","01:26:40,921"
1305,You don't know what you're talking about. Stark's not crazy.,"01:26:44,440","01:26:46,727"
1306,He will do anything to make things right.,"01:26:46,800","01:26:48,928"
1307,"Stark, come in.","01:26:53,800","01:26:55,086"
1308,Stark.,"01:26:55,600","01:26:56,647"
1309,Anyone on comms.,"01:26:57,960","01:26:59,086"
1310,Ultron can't tell the difference,"01:26:59,200","01:27:00,645"
1311,between saving the world and destroying it.,"01:27:00,800","01:27:03,121"
1312,Where do you think he gets that?,"01:27:05,040","01:27:07,486"
1313,Anything on Nat?,"01:27:09,680","01:27:11,250"
1314,I haven't heard.,"01:27:09,680","01:27:11,250"
1315,"But she's alive, or Ultron would be rubbing our faces in it.","01:27:11,360","01:27:13,727"
1316,This is sealed tight.,"01:27:13,840","01:27:15,171"
1317,"We're gonna need to access the program, break it down from within.","01:27:15,320","01:27:18,803"
1318,Any chance Natasha might leave you a message outside the Internet?,"01:27:20,040","01:27:22,766"
1319,Oldschool spy stuff?,"01:27:22,880","01:27:23,927"
1320,There are some nets I can cast.,"01:27:24,400","01:27:26,209"
1321,"Yeah, I'll find her.","01:27:26,320","01:27:27,560"
1322,I can work on tissue degeneration,"01:27:30,160","01:27:31,924"
1323,if you could fry whatever operational system Cho implanted.,"01:27:32,040","01:27:35,249"
1324,"Yeah, about that.","01:27:35,400","01:27:36,526"
1325,No.,"01:27:40,960","01:27:41,961"
1326,You have to trust me.,"01:27:42,160","01:27:44,003"
1327,Kind of don't.,"01:27:42,160","01:27:44,003"
1328,"Our ally, the guy protecting the military's nuclear codes, I found him.","01:27:44,160","01:27:51,161"
1329,"Hello, Dr Banner.","01:27:51,240","01:27:52,366"
1330,Ultron didn't go after Jarvis because he was angry.,"01:27:53,240","01:27:55,481"
1331,He attacked him because he was scared of what he can do.,"01:27:56,080","01:27:59,687"
1332,So Jarvis went underground.,"01:28:00,840","01:28:02,490"
1333,"Scattered, dumped his memory.","01:28:02,600","01:28:04,090"
1334,But not his protocols.,"01:28:04,680","01:28:06,170"
1335,He didn't even know he was in there until I pieced him together.,"01:28:06,600","01:28:10,047"
1336,"So, you want me to help you put Jarvis into this thing?","01:28:12,880","01:28:17,681"
1337,No! Of course not.,"01:28:17,800","01:28:19,564"
1338,I wanna help you put Jarvis in this thing.,"01:28:19,720","01:28:21,404"
1339,"We're out of my field, here.","01:28:23,800","01:28:25,450"
1340,You know bioorganics better than anyone.,"01:28:25,560","01:28:27,562"
1341,And you just assume that Jarvis's operational matrix,"01:28:27,880","01:28:30,770"
1342,can beat Ultron's?,"01:28:30,880","01:28:32,325"
1343,Jarvis has been beating him from inside without knowing it.,"01:28:32,440","01:28:35,728"
1344,This is the opportunity.,"01:28:35,880","01:28:36,881"
1345,We can create Ultron's perfect self,"01:28:36,960","01:28:38,724"
1346,without the homicidal glitches he thinks are his winning personality.,"01:28:38,880","01:28:42,362"
1347,We have to.,"01:28:42,480","01:28:44,562"
1348,I believe it's worth a go.,"01:28:42,480","01:28:44,562"
1349,I'm in a loop!,"01:28:47,160","01:28:48,241"
1350,I'm caught in a time loop.,"01:28:48,400","01:28:51,370"
1351,This is exactly where it all went wrong.,"01:28:48,400","01:28:51,370"
1352,I know. I know. I know what everyone's gonna say.,"01:28:51,480","01:28:53,400"
1353,But they're already saying it.,"01:28:53,480","01:28:55,448"
1354,We're mad scientists.,"01:28:56,000","01:28:57,161"
1355,"We're monsters, buddy.","01:28:57,920","01:29:00,651"
1356,We've gotta own it.,"01:28:57,920","01:29:00,651"
1357,Make a stand.,"01:29:01,640","01:29:02,880"
1358,It's not a loop.,"01:29:08,280","01:29:09,770"
1359,It's the end of the line.,"01:29:11,000","01:29:12,764"
1360,I wasn't sure you would wake up.,"01:29:33,280","01:29:35,408"
1361,I hoped you would.,"01:29:35,520","01:29:38,967"
1362,I wanted to show you.,"01:29:35,520","01:29:38,967"
1363,I don't have anyone else.,"01:29:39,120","01:29:40,804"
1364,I think a lot about meteors.,"01:29:43,640","01:29:47,247"
1365,The purity in them.,"01:29:43,640","01:29:47,247"
1366,Boom! The end.,"01:29:47,400","01:29:48,925"
1367,Start again.,"01:29:49,400","01:29:50,811"
1368,The world made clean,"01:29:50,960","01:29:52,928"
1369,for the new man to rebuild.,"01:29:53,040","01:29:55,361"
1370,I was meant to be new.,"01:29:55,680","01:29:57,808"
1371,I was meant to be beautiful.,"01:29:58,680","01:30:01,286"
1372,The world would have looked to the sky,"01:30:01,840","01:30:03,968"
1373,"and seen hope, seen mercy.","01:30:04,080","01:30:07,011"
1374,"Instead, they'll look up in horror","01:30:07,800","01:30:09,882"
1375,because of you.,"01:30:10,000","01:30:11,331"
1376,You've wounded me.,"01:30:11,520","01:30:13,329"
1377,I give you full marks for that.,"01:30:14,000","01:30:15,684"
1378,"But, like the man said, what doesn't kill me...","01:30:16,320","01:30:19,244"
1379,...just makes me stronger.,"01:30:24,480","01:30:25,811"
1380,This framework is not compatible.,"01:31:05,880","01:31:08,042"
1381,The genetic coding tower is at 97%.,"01:31:08,200","01:31:10,885"
1382,You have got to upload that schematic in the next three minutes.,"01:31:11,000","01:31:14,846"
1383,I'm gonna say this once.,"01:31:17,120","01:31:19,043"
1384,How about nonece?,"01:31:17,120","01:31:19,043"
1385,Shut it down!,"01:31:19,240","01:31:21,288"
1386,"Nope, not gonna happen.","01:31:19,240","01:31:21,288"
1387,You don't know what you're doing.,"01:31:21,400","01:31:22,561"
1388,And you do?,"01:31:22,720","01:31:24,051"
1389,She's not in your head?,"01:31:24,400","01:31:25,401"
1390,I know you're angry.,"01:31:25,560","01:31:27,210"
1391,We're way past that.,"01:31:27,320","01:31:28,685"
1392,I could choke the life out of you and never change a shade.,"01:31:28,800","01:31:31,246"
1393,"Banner, after everything that's happened...","01:31:31,480","01:31:33,160"
1394,It's nothing compared to what's coming!,"01:31:33,240","01:31:34,605"
1395,You don't know what's in there.,"01:31:34,720","01:31:37,087"
1396,This isn't a game!,"01:31:34,720","01:31:37,087"
1397,"No, no. Go on.","01:31:40,400","01:31:41,811"
1398,You were saying?,"01:31:42,760","01:31:44,683"
1399,Pietro!,"01:31:50,920","01:31:51,967"
1400,What?,"01:31:52,520","01:31:53,601"
1401,You didn't see that coming?,"01:31:54,000","01:31:55,570"
1402,I'm rerouting the upload.,"01:31:57,760","01:31:58,921"
1403,"Go ahead, piss me off.","01:32:05,240","01:32:07,004"
1404,Wait!,"01:32:19,320","01:32:20,446"
1405,I am sorry. That was,"01:33:45,120","01:33:47,361"
1406,odd.,"01:33:48,360","01:33:49,771"
1407,Thank you.,"01:33:50,000","01:33:51,240"
1408,Thor.,"01:33:56,160","01:33:57,207"
1409,You helped create this?,"01:33:58,720","01:34:01,326"
1410,I've had a vision.,"01:33:58,720","01:34:01,326"
1411,"A whirlpool that sucks in all hope of life, and at its centre is that.","01:34:01,560","01:34:05,281"
1412,What? The gem?,"01:34:06,240","01:34:07,241"
1413,It's the Mind Stone.,"01:34:07,400","01:34:09,971"
1414,It's one of the six Infinity Stones.,"01:34:07,400","01:34:09,971"
1415,"The greatest power in the universe, unparalleled in its destructive capabilities.","01:34:10,120","01:34:13,642"
1416,Then why would you bring...,"01:34:13,760","01:34:15,728"
1417,Because Stark is right.,"01:34:13,760","01:34:15,728"
1418,It's definitely the end times.,"01:34:15,920","01:34:18,366"
1419,The Avengers cannot defeat Ultron.,"01:34:18,560","01:34:19,721"
1420,Not alone.,"01:34:19,880","01:34:21,120"
1421,Why does your Vision sound like Jarvis?,"01:34:21,520","01:34:23,443"
1422,We reconfigured Jarvis's matrix,"01:34:23,560","01:34:26,245"
1423,to create something new.,"01:34:26,760","01:34:28,524"
1424,I think I've had my fill of new.,"01:34:28,760","01:34:30,444"
1425,You think I'm a child of Ultron.,"01:34:30,600","01:34:32,887"
1426,You're not?,"01:34:33,240","01:34:34,526"
1427,I'm not Ultron.,"01:34:35,680","01:34:37,250"
1428,I am not Jarvis. I am...,"01:34:37,880","01:34:40,087"
1429,I am.,"01:34:42,200","01:34:43,611"
1430,I looked in your head,"01:34:45,520","01:34:46,646"
1431,and saw annihilation.,"01:34:47,360","01:34:49,124"
1432,Look again.,"01:34:49,280","01:34:50,645"
1433,Her seal of approval means jack to me.,"01:34:50,760","01:34:52,280"
1434,"Their powers, the horrors in our heads, Ultron himself, they all came from the Mind Stone.","01:34:52,760","01:34:56,968"
1435,And they're nothing compared to what it can unleash.,"01:34:57,120","01:34:59,282"
1436,But with it on our side...,"01:34:59,440","01:35:00,965"
1437,Is it?,"01:34:59,440","01:35:00,965"
1438,Are you?,"01:35:02,400","01:35:03,561"
1439,On our side?,"01:35:04,440","01:35:05,885"
1440,I don't think it's that simple.,"01:35:07,760","01:35:09,649"
1441,"Well, it better get real simple real soon.","01:35:09,800","01:35:12,246"
1442,I am on the side of life.,"01:35:13,400","01:35:15,528"
1443,Ultron isn't.,"01:35:15,760","01:35:17,125"
1444,He will end it all.,"01:35:17,720","01:35:19,131"
1445,What's he waiting for?,"01:35:19,280","01:35:21,203"
1446,You.,"01:35:21,360","01:35:22,361"
1447,Where?,"01:35:21,360","01:35:22,361"
1448,Sokovia.,"01:35:22,800","01:35:23,961"
1449,"He's got Nat there, too.","01:35:24,080","01:35:25,161"
1450,"If we're wrong about you, if you're the monster that Ultron made you to be...","01:35:27,320","01:35:33,640"
1451,What will you do?,"01:35:34,160","01:35:35,685"
1452,I don't want to kill Ultron.,"01:35:42,320","01:35:44,402"
1453,He's unique and he's in pain.,"01:35:44,800","01:35:48,122"
1454,But that pain will roll over the Earth.,"01:35:49,680","01:35:52,251"
1455,"So, he must be destroyed.","01:35:52,800","01:35:55,087"
1456,"Every form he's built, every trace of his presence on the net.","01:35:55,320","01:35:58,244"
1457,We have to act now.,"01:35:58,520","01:36:00,170"
1458,And not one of us can do it without the others.,"01:36:00,600","01:36:04,525"
1459,Maybe I am a monster.,"01:36:06,520","01:36:08,443"
1460,I don't think I'd know if I were one.,"01:36:08,600","01:36:10,841"
1461,"I'm not what you are, and not what you intended.","01:36:12,000","01:36:16,442"
1462,"So, there may be no way to make you trust me.","01:36:17,200","01:36:19,680"
1463,But we need to go.,"01:36:19,960","01:36:21,371"
1464,Right.,"01:36:36,160","01:36:37,321"
1465,Well done.,"01:36:37,960","01:36:39,200"
1466,Three minutes.,"01:36:40,960","01:36:42,007"
1467,Get what you need.,"01:36:42,720","01:36:44,370"
1468,"Good evening, boss.","01:37:00,200","01:37:01,247"
1469,No way we all get through this.,"01:37:06,400","01:37:08,084"
1470,"If even one tin soldier is left standing, we've lost.","01:37:08,200","01:37:10,280"
1471,There's gonna be blood on the floor.,"01:37:11,000","01:37:12,440"
1472,I got no plans tomorrow night.,"01:37:12,480","01:37:13,891"
1473,I get first crack at the big guy.,"01:37:14,000","01:37:15,320"
1474,Iron Man's the one he's waiting for.,"01:37:15,760","01:37:17,250"
1475,That's true. He hates you the most.,"01:37:17,360","01:37:19,761"
1476,Ultron knows we're coming.,"01:37:25,080","01:37:27,242"
1477,Odds are we'll be riding into heavy fire.,"01:37:27,520","01:37:29,727"
1478,And that's what we signed up for.,"01:37:30,240","01:37:31,969"
1479,"But the people of Sokovia, they didn't.","01:37:32,240","01:37:34,766"
1480,So our priority,"01:37:35,880","01:37:37,370"
1481,is getting them out.,"01:37:38,080","01:37:39,161"
1482,We're under attack! Clear the city! Now!,"01:37:39,400","01:37:42,324"
1483,Get off your asses.,"01:37:50,120","01:37:51,565"
1484,All they want is to live their lives in peace.,"01:37:52,800","01:37:54,723"
1485,And that's not gonna happen today.,"01:37:55,280","01:37:56,640"
1486,But we can do our best to protect them.,"01:37:58,280","01:38:00,009"
1487,And we can get the job done.,"01:38:00,720","01:38:02,245"
1488,"We find out what Ultron's been building, we find Romanoff, and we clear the field.","01:38:05,640","01:38:12,803"
1489,Keep the fight between us.,"01:38:14,240","01:38:16,163"
1490,Ultron thinks we're monsters.,"01:38:22,880","01:38:25,281"
1491,That we're what's wrong with the world.,"01:38:25,800","01:38:28,201"
1492,This isn't just about beating him.,"01:38:28,320","01:38:30,641"
1493,It's about whether he's right.,"01:38:31,160","01:38:33,208"
1494,Natasha!,"01:38:39,680","01:38:40,727"
1495,Natasha!,"01:38:41,840","01:38:42,841"
1496,Bruce?,"01:38:43,000","01:38:44,081"
1497,You all right?,"01:38:45,520","01:38:46,521"
1498,Yeah.,"01:38:46,680","01:38:47,727"
1499,The team is in the city.,"01:38:47,840","01:38:49,569"
1500,It's about to light up.,"01:38:47,840","01:38:49,569"
1501,I don't suppose you found a key lying around somewhere.,"01:38:49,680","01:38:51,840"
1502,Yeah. I did.,"01:38:52,160","01:38:54,288"
1503,So what's our play?,"01:39:00,680","01:39:01,841"
1504,I'm here to get you to safety.,"01:39:02,040","01:39:03,405"
1505,Job's not finished.,"01:39:04,160","01:39:06,686"
1506,"We could help with the evacuation, but I can't be in a fight near civilians.","01:39:04,160","01:39:08,683"
1507,And you've done plenty.,"01:39:10,040","01:39:11,201"
1508,Our fight is over.,"01:39:13,600","01:39:15,090"
1509,"So, we just disappear?","01:39:16,480","01:39:18,721"
1510,Come on.,"01:39:22,880","01:39:24,723"
1511,"Your man's in the church, boss.","01:39:29,520","01:39:31,761"
1512,I think he's waiting for you.,"01:39:31,880","01:39:33,723"
1513,Come to confess your sins?,"01:39:37,800","01:39:39,848"
1514,I don't know. How much time you got?,"01:39:39,960","01:39:41,200"
1515,More than you.,"01:39:41,360","01:39:42,850"
1516,Have you been juicing?,"01:39:45,240","01:39:48,050"
1517,Little vibranium cocktail?,"01:39:45,240","01:39:48,050"
1518,You're looking...,"01:39:48,160","01:39:50,447"
1519,I don't wanna say puffy.,"01:39:48,160","01:39:50,447"
1520,You're stalling to protect the people.,"01:39:50,560","01:39:52,289"
1521,"Well, that is the mission. Did you forget?","01:39:52,680","01:39:55,524"
1522,I've moved beyond your mission. I'm free.,"01:39:55,840","01:39:58,320"
1523,What?,"01:40:03,080","01:40:04,127"
1524,You think you were the only one stalling?,"01:40:05,040","01:40:07,361"
1525,There's the rest of the vibranium.,"01:40:08,080","01:40:09,730"
1526,"Function, still unclear.","01:40:09,840","01:40:11,251"
1527,"This is how you end, Tony.","01:40:11,440","01:40:12,601"
1528,This is peace in my time.,"01:40:13,880","01:40:15,644"
1529,Go!,"01:40:32,360","01:40:33,407"
1530,Get off the bridge!,"01:40:38,960","01:40:40,291"
1531,Run!,"01:40:44,440","01:40:45,441"
1532,Ultron.,"01:40:47,440","01:40:49,249"
1533,My Vision.,"01:40:54,760","01:40:55,966"
1534,They really did take everything from me.,"01:40:56,200","01:40:58,487"
1535,You set the terms.,"01:40:58,640","01:41:00,688"
1536,You can change them.,"01:40:58,640","01:41:00,688"
1537,All right.,"01:41:00,800","01:41:02,040"
1538,"Friday, the Vision?","01:41:26,240","01:41:27,480"
1539,"Boss, it's working.","01:41:27,640","01:41:29,800"
1540,He's burning Ultron out of the net.,"01:41:27,640","01:41:29,800"
1541,He won't escape through there.,"01:41:29,840","01:41:31,040"
1542,You shut me out.,"01:41:36,120","01:41:37,451"
1543,You think I care?,"01:41:37,920","01:41:39,126"
1544,"You take away my world, I take away yours.","01:41:41,120","01:41:44,929"
1545,Friday.,"01:42:29,480","01:42:30,686"
1546,Sokovia is going for a ride.,"01:42:30,800","01:42:33,246"
1547,Do you see,"01:42:45,760","01:42:47,250"
1548,the beauty of it?,"01:42:47,720","01:42:49,245"
1549,The inevitability.,"01:42:49,840","01:42:51,683"
1550,"You rise, only to fall.","01:42:51,920","01:42:55,163"
1551,"You, Avengers, you are my meteor.","01:42:57,920","01:43:00,764"
1552,My swift and terrible sword.,"01:43:01,680","01:43:03,409"
1553,And the earth will crack,"01:43:03,600","01:43:05,090"
1554,with the weight of your failure.,"01:43:05,280","01:43:07,203"
1555,"Purge me from your computers, turn my own flesh against me.","01:43:08,880","01:43:12,646"
1556,It means nothing.,"01:43:13,120","01:43:14,531"
1557,"When the dust settles, the only thing living in this world","01:43:15,600","01:43:19,009"
1558,will be metal.,"01:43:19,520","01:43:20,521"
1559,We gotta move.,"01:43:25,080","01:43:26,650"
1560,You're not gonna turn green?,"01:43:26,960","01:43:28,080"
1561,I've got a compelling reason not to lose my cool.,"01:43:28,280","01:43:30,200"
1562,I adore you.,"01:43:31,360","01:43:32,646"
1563,But I need the other guy.,"01:43:41,280","01:43:43,203"
1564,Let's finish the job.,"01:43:48,040","01:43:49,804"
1565,I really hope this makes us even.,"01:44:06,600","01:44:08,011"
1566,Now go be a hero.,"01:44:10,320","01:44:12,368"
1567,The vibranium core's got a magnetic field.,"01:44:20,840","01:44:22,763"
1568,That's what's keeping the rock together.,"01:44:22,920","01:44:24,922"
1569,If it drops?,"01:44:25,040","01:44:26,087"
1570,"Right now, the impact will kill thousands.","01:44:26,160","01:44:27,491"
1571,Once it gets high enough?,"01:44:27,560","01:44:30,291"
1572,Global extinction.,"01:44:27,560","01:44:30,291"
1573,That building's not clear. The 10th floor.,"01:44:34,600","01:44:36,682"
1574,Hi.,"01:44:41,560","01:44:42,561"
1575,Okay. Get in the tub!,"01:44:43,680","01:44:46,047"
1576,"I got airborne, heading up to the bridge.","01:44:52,880","01:44:54,723"
1577,"Cap, you got incoming.","01:44:57,520","01:44:58,726"
1578,Incoming already came in.,"01:44:58,880","01:45:00,530"
1579,"Stark, you worry about bringing the city back down safely.","01:45:03,200","01:45:05,680"
1580,"The rest of us have one job, tear these things apart.","01:45:06,400","01:45:09,521"
1581,"You get hurt, hurt them back.","01:45:09,840","01:45:11,444"
1582,"You get killed, walk it off.","01:45:12,120","01:45:15,606"
1583,"Go, go, go!","01:45:50,040","01:45:51,246"
1584,How could I let this happen?,"01:45:56,920","01:45:58,684"
1585,"Hey, hey, you okay?","01:45:58,800","01:46:00,848"
1586,This is all our fault.,"01:45:58,800","01:46:00,848"
1587,"Hey, look at me.","01:46:01,040","01:46:03,240"
1588,"It's your fault, it's everyone's fault.","01:46:01,040","01:46:03,240"
1589,Who cares?,"01:46:03,280","01:46:04,327"
1590,Are you up for this?,"01:46:04,440","01:46:05,965"
1591,Are you?,"01:46:06,080","01:46:07,161"
1592,"Look, I just need to know.","01:46:07,400","01:46:10,807"
1593,Because the city is flying.,"01:46:07,400","01:46:10,807"
1594,"Okay. Look, the city is flying, we're fighting an army of robots, and I have a bow and arrow.","01:46:11,120","01:46:17,126"
1595,None of this makes sense.,"01:46:17,280","01:46:18,361"
1596,But I'm going back out there because it's my job.,"01:46:21,640","01:46:23,768"
1597,Okay? And I can't do my job and babysit.,"01:46:24,640","01:46:27,291"
1598,It doesn't matter what you did or what you were.,"01:46:27,440","01:46:30,444"
1599,"If you go out there, you fight, and you fight to kill.","01:46:30,640","01:46:33,246"
1600,"Stay in here, you're good.","01:46:34,280","01:46:36,920"
1601,I'll send your brother to come find you.,"01:46:34,280","01:46:36,920"
1602,"But if you step out that door, you are an Avenger.","01:46:36,960","01:46:40,721"
1603,All right. Good chat.,"01:46:45,600","01:46:47,409"
1604,"Yeah, the city is flying.","01:46:51,160","01:46:52,207"
1605,I got you!,"01:47:26,200","01:47:27,361"
1606,Just look at me!,"01:47:27,680","01:47:28,920"
1607,You can't save them all.,"01:47:35,680","01:47:37,011"
