,line,start,end
0,Report to your stations immediately.,"00:00:42,800","00:00:44,802"
1,This is not a drill. We are under attack!,"00:00:44,960","00:00:47,721"
2,We are under attack!,"00:00:49,120","00:00:51,088"
3,Shit!,"00:01:52,200","00:01:54,487"
4,Language!,"00:01:52,200","00:01:54,487"
5,"Jarvis, what's the view from upstairs?","00:01:54,600","00:01:56,204"
6,The central building is protected by some kind of energy shield.,"00:01:56,600","00:02:00,286"
7,Strucker's technology is well beyond any other Hydra base we've taken.,"00:02:00,800","00:02:04,522"
8,Loki's sceptre must be here.,"00:02:07,360","00:02:08,930"
9,Strucker couldn't mount this defence without it.,"00:02:09,560","00:02:11,440"
10,At long last.,"00:02:12,160","00:02:13,730"
11,"At long last is lasting a little long, boys.","00:02:25,200","00:02:27,407"
12,Yeah. I think we lost the element of surprise.,"00:02:32,320","00:02:34,846"
13,Wait a second.,"00:02:36,400","00:02:38,607"
14,No one else is gonna deal with the fact,"00:02:36,400","00:02:38,607"
15,that Cap just said Language?,"00:02:38,760","00:02:40,524"
16,I know.,"00:02:40,680","00:02:42,205"
17,Just slipped out.,"00:02:47,240","00:02:49,527"
18,Who gave the order to attack?,"00:02:55,600","00:02:57,364"
19,"Herr Strucker, it's the Avengers.","00:02:57,480","00:02:59,767"
20,They landed in the far woods.,"00:02:59,920","00:03:02,764"
21,The perimeter guard panicked.,"00:02:59,920","00:03:02,764"
22,They have to be after the sceptre.,"00:03:02,920","00:03:04,843"
23,Can we hold them?,"00:03:06,080","00:03:08,447"
24,They're the Avengers.,"00:03:06,080","00:03:08,447"
25,Deploy the rest of the tanks.,"00:03:08,560","00:03:10,164"
26,Concentrate fire on the weak ones.,"00:03:10,320","00:03:12,209"
27,A hit may make them close ranks.,"00:03:12,360","00:03:14,681"
28,Everything we've accomplished...,"00:03:16,280","00:03:18,123"
29,But we're on the verge of our greatest breakthrough.,"00:03:18,280","00:03:20,601"
30,Then let's show them what we've accomplished.,"00:03:20,800","00:03:22,404"
31,Send out the twins.,"00:03:22,520","00:03:24,204"
32,It's too soon.,"00:03:25,480","00:03:27,289"
33,It's what they signed up for.,"00:03:27,400","00:03:29,528"
34,My men can hold them.,"00:03:30,080","00:03:32,003"
35,"Sir, the city is taking fire.","00:03:39,640","00:03:41,529"
36,"Well, we know Strucker's not gonna worry about civilian casualties.","00:03:44,400","00:03:47,882"
37,Send in the Iron Legion.,"00:03:48,040","00:03:49,690"
38,This quadrant is unsafe.,"00:03:54,920","00:03:57,491"
39,Please back away.,"00:03:54,920","00:03:57,491"
40,We are here to help.,"00:03:58,400","00:04:00,004"
41,This quadrant is unsafe.,"00:04:01,120","00:04:03,487"
42,Please back away.,"00:04:01,120","00:04:03,487"
43,Please back away.,"00:04:05,240","00:04:06,321"
44,We wish to avoid collateral damage.,"00:04:06,440","00:04:08,568"
45,Costel!,"00:04:06,440","00:04:08,568"
46,We will inform you when this current conflict is resolved.,"00:04:08,680","00:04:11,160"
47,We are here to help.,"00:04:11,280","00:04:13,328"
48,"Avengers, go home!","00:04:11,280","00:04:13,328"
49,We are here to help.,"00:04:15,760","00:04:16,921"
50,We will not yield!,"00:04:18,000","00:04:19,843"
51,The Americans sent their circus freaks to test us.,"00:04:20,480","00:04:23,768"
52,We will send them back in bags.,"00:04:24,360","00:04:26,806"
53,No surrender!,"00:04:29,160","00:04:32,050"
54,No surrender!,"00:04:29,160","00:04:32,050"
55,I am going to surrender.,"00:04:33,200","00:04:35,089"
56,You delete everything.,"00:04:35,760","00:04:37,171"
57,"If we give the Avengers the weapons, they may not look too far into what we've been...","00:04:37,320","00:04:40,690"
58,The twins.,"00:04:40,840","00:04:42,922"
59,They are not ready to take on...,"00:04:40,840","00:04:42,922"
60,"No, no, I mean...","00:04:43,040","00:04:45,247"
61,Twins.,"00:04:45,360","00:04:46,850"
62,You didn't see that coming?,"00:05:13,160","00:05:15,083"
63,Clint!,"00:05:21,360","00:05:23,681"
64,We have an Enhanced in the field.,"00:05:25,760","00:05:27,080"
65,Clint's hit!,"00:05:27,160","00:05:28,161"
66,Somebody want to deal with that bunker?,"00:05:32,560","00:05:34,080"
67,Thank you.,"00:05:38,080","00:05:39,286"
68,"Stark, we really need to get inside.","00:05:46,400","00:05:48,880"
69,I'm closing in.,"00:05:49,280","00:05:50,281"
70,"Jarvis, am I closing in?","00:05:53,400","00:05:55,528"
71,Do you see a power source for that shield?,"00:05:56,520","00:05:58,443"
72,There's a particle wave below the north tower.,"00:05:58,600","00:06:01,126"
73,"Great, I want to poke it with something.","00:06:01,240","00:06:03,242"
74,"The drawbridge is down, people.","00:06:11,200","00:06:13,123"
75,The Enhanced?,"00:06:17,280","00:06:19,282"
76,He's a blur.,"00:06:17,280","00:06:19,282"
77,"All the new players we've faced, I've never seen this.","00:06:19,960","00:06:22,080"
78,"In fact, I still haven't.","00:06:22,480","00:06:23,766"
79,"Clint's hit pretty bad, guys. We're gonna need evac.","00:06:23,880","00:06:26,167"
80,I can get Barton to the jet.,"00:06:26,320","00:06:29,245"
81,"The sooner we're gone, the better.","00:06:26,320","00:06:29,245"
82,You and Stark secure the sceptre.,"00:06:29,400","00:06:31,721"
83,Copy that.,"00:06:29,400","00:06:31,721"
84,Looks like they're lining up.,"00:06:32,960","00:06:34,769"
85,"Well, they're excited.","00:06:35,080","00:06:36,570"
86,Find the sceptre.,"00:06:40,440","00:06:41,805"
87,"And for gosh sake, watch your language!","00:06:42,800","00:06:45,007"
88,That's not going away any time soon.,"00:06:46,480","00:06:48,403"
89,"Guys, stop. We gotta talk this through.","00:06:54,320","00:06:56,527"
90,It was a good talk.,"00:06:59,520","00:07:02,166"
91,"No, it wasn't.","00:06:59,520","00:07:02,166"
92,Sentry mode.,"00:07:08,360","00:07:10,283"
93,"Okay, Jarvis, you know. I want it all.","00:07:12,640","00:07:16,603"
94,Make sure you copy Hill at HQ.,"00:07:12,640","00:07:16,603"
95,We're locked down out here.,"00:07:21,000","00:07:22,286"
96,Then get to Banner. Time for a lullaby.,"00:07:22,840","00:07:24,968"
97,I know you're hiding more than files.,"00:07:28,680","00:07:30,762"
98,"Hey, J, give me an IR scan of the room, real quick.","00:07:31,960","00:07:34,566"
99,The wall to your left.,"00:07:34,720","00:07:36,245"
100,I'm reading steel reinforcement,"00:07:36,360","00:07:38,010"
101,and an air current.,"00:07:39,240","00:07:40,890"
102,Please be a secret door.,"00:07:41,200","00:07:42,201"
103,Please be a secret door.,"00:07:42,360","00:07:44,280"
104,Please be a secret door.,"00:07:42,360","00:07:44,280"
105,Yay.,"00:07:44,920","00:07:45,921"
106,"Hey, big guy.","00:08:02,200","00:08:04,123"
107,Sun's getting real low.,"00:08:06,480","00:08:08,130"
108,Baron Strucker.,"00:09:12,200","00:09:13,804"
109,Hydra's number one thug.,"00:09:14,320","00:09:16,243"
110,"Technically, I'm a thug for S.H.I.E.L.D.","00:09:16,960","00:09:19,486"
111,"Well, then technically you're unemployed.","00:09:19,640","00:09:21,688"
112,Where's Loki's sceptre?,"00:09:22,120","00:09:23,770"
113,"Don't worry, I know when I'm beat.","00:09:23,880","00:09:25,803"
114,"You'll mention how I cooperated, I hope.","00:09:26,720","00:09:29,291"
115,I'll put it right under illegal human experimentation.,"00:09:29,440","00:09:31,886"
116,How many are there?,"00:09:33,080","00:09:34,525"
117,We have a second Enhanced.,"00:09:39,480","00:09:42,404"
118,Female. Do not engage.,"00:09:39,480","00:09:42,404"
119,You'll have to be faster than...,"00:09:43,840","00:09:45,330"
120,"Guys, I got Strucker.","00:09:50,520","00:09:52,170"
121,"Yeah, I got something bigger.","00:09:52,360","00:09:55,762"
122,"Thor, I got eyes on the prize.","00:10:19,040","00:10:23,043"
123,You could have saved us.,"00:11:12,880","00:11:16,248"
124,Why didn't you do more?,"00:11:24,280","00:11:26,248"
125,We're just gonna let him take it?,"00:12:03,760","00:12:05,569"
126,"Hey, the lullaby worked better than ever.","00:12:57,440","00:12:59,681"
127,Just wasn't expecting a code green.,"00:13:01,480","00:13:03,369"
128,"You hadn't been there, there would have been double the casualties.","00:13:03,440","00:13:07,404"
129,My best friend would've been a treasured memory.,"00:13:07,520","00:13:10,046"
130,"You know, sometimes exactly what I want to hear","00:13:10,800","00:13:12,723"
131,isn't exactly what I want to hear.,"00:13:12,840","00:13:14,649"
132,How long before you trust me?,"00:13:15,800","00:13:17,723"
133,It's not you I don't trust.,"00:13:19,720","00:13:21,449"
134,"Thor, report on the Hulk.","00:13:23,320","00:13:25,049"
135,The gates of Hel are filled with the screams of his victims.,"00:13:25,240","00:13:28,084"
136,"But not the screams of the dead, of course. No, no, wounded screams.","00:13:30,120","00:13:33,124"
137,"Mainly whimpering, a great deal of complaining","00:13:33,240","00:13:35,447"
138,and tales of sprained deltoids and gout.,"00:13:35,560","00:13:39,565"
139,"Hey, Banner, Dr Cho is on her way in from Seoul.","00:13:40,080","00:13:42,924"
140,Is it okay if she sets up in your lab?,"00:13:43,080","00:13:44,600"
141,"Yeah, she knows her way around.","00:13:44,640","00:13:46,563"
142,Thanks. Tell her to prep everything.,"00:13:46,760","00:13:47,966"
143,Barton's gonna need the full treatment.,"00:13:48,080","00:13:49,411"
144,"Very good, sir.","00:13:49,560","00:13:51,403"
145,"Jarvis, take the wheel.","00:13:49,560","00:13:51,403"
146,"Yes, sir.","00:13:51,600","00:13:52,886"
147,Approach vector is locked.,"00:13:53,000","00:13:54,889"
148,"Feels good, yeah?","00:13:55,040","00:13:57,441"
149,"I mean, you've been after this thing since S.H.I.E.L.D. collapsed.","00:13:57,560","00:13:59,642"
150,"Not that I haven't enjoyed our little raiding parties, but...","00:13:59,760","00:14:01,808"
151,"No, but this... This brings it to a close.","00:14:01,920","00:14:04,321"
152,As soon as we find out what else this has been used for.,"00:14:05,080","00:14:06,923"
153,I don't just mean weapons.,"00:14:07,080","00:14:08,286"
154,Since when is Strucker capable of human enhancement?,"00:14:08,800","00:14:11,121"
155,Banner and I will give it the once over before it goes back to Asgard.,"00:14:11,280","00:14:13,521"
156,Is that cool with you?,"00:14:13,640","00:14:14,687"
157,Just a few days till the farewell party.,"00:14:14,760","00:14:16,808"
158,"You're staying, right?","00:14:17,360","00:14:19,089"
159,"Yes, yes, of course. A victory should be honoured with revels.","00:14:19,200","00:14:21,931"
160,"Yeah, who doesn't love revels? Captain?","00:14:22,040","00:14:24,805"
161,Hopefully this puts an end to the Chitauri and Hydra.,"00:14:24,960","00:14:27,850"
162,"So, yes, revels.","00:14:27,960","00:14:29,564"
163,"Lab's all set up, boss.","00:15:03,640","00:15:04,687"
164,"Actually, he's the boss.","00:15:04,840","00:15:05,966"
165,I just pay for everything and design everything,"00:15:06,080","00:15:08,481"
166,and make everyone look cooler.,"00:15:08,640","00:15:10,165"
167,What's the word on Strucker?,"00:15:10,320","00:15:11,685"
168,NATO's got him.,"00:15:11,800","00:15:13,848"
169,The two Enhanced?,"00:15:11,800","00:15:13,848"
170,Wanda and Pietro Maximoff. Twins.,"00:15:13,960","00:15:16,566"
171,Orphaned at 10 when a shell collapsed their apartment building.,"00:15:16,680","00:15:19,524"
172,Sokovia's had a rough history.,"00:15:19,880","00:15:22,167"
173,"It's nowhere special, but it's on the way to everywhere special.","00:15:22,320","00:15:25,722"
174,Their abilities?,"00:15:25,840","00:15:27,001"
175,He's got increased metabolism and improved thermal homeostasis.,"00:15:27,120","00:15:29,964"
176,"Her thing is neuroelectric interfacing, telekinesis, mental manipulation.","00:15:30,120","00:15:34,402"
177,He's fast and she's weird.,"00:15:35,160","00:15:36,650"
178,"Well, they're gonna show up again.","00:15:37,480","00:15:39,562"
179,Agreed. File says they volunteered for Strucker's experiments.,"00:15:39,680","00:15:43,529"
180,It's nuts.,"00:15:43,640","00:15:45,529"
181,Right.,"00:15:43,640","00:15:45,529"
182,What kind of monster would let a German scientist experiment on them,"00:15:45,680","00:15:48,843"
183,to protect their country?,"00:15:48,960","00:15:50,200"
184,"We're not at war, Captain.","00:15:50,360","00:15:52,089"
185,They are.,"00:15:52,880","00:15:53,927"
186,How's he doing?,"00:16:24,040","00:16:25,371"
187,"Unfortunately, he's still Barton.","00:16:25,480","00:16:26,800"
188,That's terrible.,"00:16:26,920","00:16:28,206"
189,He's fine. He's thirsty.,"00:16:28,360","00:16:29,930"
190,"All right. Look alive, Jarvis.","00:16:30,040","00:16:32,930"
191,It's playtime.,"00:16:30,040","00:16:32,930"
192,"We've only got a couple of days with this joystick, so let's make the most of it.","00:16:33,040","00:16:37,083"
193,Update me on the structural and compositional analysis.,"00:16:37,240","00:16:40,767"
194,The sceptre is alien.,"00:16:41,920","00:16:43,922"
195,There are elements I can't quantify.,"00:16:44,080","00:16:46,082"
196,So there's elements you can?,"00:16:46,200","00:16:47,611"
197,The jewel appears to be a protective housing,"00:16:47,760","00:16:49,762"
198,"for something inside, something powerful.","00:16:49,880","00:16:52,771"
199,Like a reactor?,"00:16:52,880","00:16:53,961"
200,Like a computer.,"00:16:54,080","00:16:55,320"
201,I believe I'm deciphering code.,"00:16:55,440","00:16:57,602"
202,Are you sure he's gonna be okay?,"00:16:59,920","00:17:01,490"
203,Pretending to need this guy really brings the team together.,"00:17:02,800","00:17:05,160"
204,There's no possibility of deterioration.,"00:17:05,280","00:17:07,760"
205,The nanomolecular functionality is instantaneous.,"00:17:07,960","00:17:11,043"
206,His cells don't know they're bonding with simulacra.,"00:17:11,160","00:17:13,200"
207,She's creating tissue.,"00:17:13,280","00:17:15,169"
208,"If you brought him to my lab, the Regeneration Cradle could do this in 20 minutes.","00:17:15,280","00:17:19,406"
209,He's flatlining. Call it. Time?,"00:17:19,520","00:17:21,443"
210,"No, no, no, I'm gonna live forever.","00:17:21,640","00:17:24,007"
211,I'm gonna be made of plastic.,"00:17:24,120","00:17:27,131"
212,Here's your beverage.,"00:17:24,120","00:17:27,131"
213,"You'll be made of you, Mr Barton.","00:17:27,240","00:17:28,969"
214,Your own girlfriend won't be able to tell the difference.,"00:17:29,120","00:17:30,690"
215,I don't have a girlfriend.,"00:17:30,800","00:17:31,926"
216,That I can't fix.,"00:17:32,040","00:17:33,326"
217,"This is the next thing, Tony.","00:17:34,160","00:17:36,128"
218,Your clunky metal suits are gonna be left in the dust.,"00:17:36,320","00:17:38,440"
219,That is exactly the plan.,"00:17:38,480","00:17:40,209"
220,"And, Helen, I expect to see you at the party on Saturday.","00:17:41,160","00:17:44,004"
221,"Unlike you, I don't have a lot of time for parties.","00:17:44,160","00:17:46,561"
222,Will Thor be there?,"00:17:48,040","00:17:49,804"
223,What's the rumpus?,"00:17:51,880","00:17:54,326"
224,"Well, the sceptre.","00:17:51,880","00:17:54,326"
225,"You see, we were wondering how Strucker got so inventive.","00:17:55,520","00:17:59,127"
226,So I've been analysing the gem inside.,"00:17:59,240","00:18:03,165"
227,You may recognise...,"00:18:03,720","00:18:05,688"
228,Jarvis.,"00:18:07,160","00:18:08,525"
229,Doctor.,"00:18:07,160","00:18:08,525"
230,"Started out, Jarvis was just a natural language UI.","00:18:09,280","00:18:12,602"
231,Now he runs the Iron Legion.,"00:18:12,720","00:18:13,840"
232,He runs more of the business than anyone besides Pepper.,"00:18:14,320","00:18:18,007"
233,Top of the line.,"00:18:18,120","00:18:19,246"
234,Yes.,"00:18:18,120","00:18:19,246"
235,I suspect not for long.,"00:18:19,360","00:18:20,646"
236,Meet the competition.,"00:18:21,840","00:18:22,921"
237,It's beautiful.,"00:18:29,040","00:18:30,201"
238,"If you had to guess, what's it look like it's doing?","00:18:29,040","00:18:33,324"
239,Like it's thinking.,"00:18:30,320","00:18:33,324"
240,"I mean, this could be...","00:18:34,080","00:18:35,889"
241,It's not a human mind.,"00:18:36,320","00:18:38,402"
242,"I mean, look at this.","00:18:38,640","00:18:40,529"
243,They're like neurons firing.,"00:18:40,720","00:18:42,882"
244,"Down in Strucker's lab, I saw some fairly advanced robotics work.","00:18:43,480","00:18:46,563"
245,"They deepsixed the data, but I gotta guess he was knocking on a very particular door.","00:18:47,680","00:18:53,489"
246,Artificial intelligence.,"00:18:55,440","00:18:56,771"
247,"This could be it, Bruce.","00:18:59,760","00:19:02,650"
248,This could be the key to creating Ultron.,"00:18:59,760","00:19:02,650"
249,I thought Ultron was a fantasy.,"00:19:05,280","00:19:06,611"
250,Yesterday it was.,"00:19:06,720","00:19:08,006"
251,"If we can harness this power, apply it to my Iron Legion protocol?","00:19:09,120","00:19:13,328"
252,That's a mansized if.,"00:19:14,120","00:19:16,088"
253,Our job is if.,"00:19:16,240","00:19:18,561"
254,"What if you were sipping margaritas on a sundrenched beach, turning brown instead of green?","00:19:18,680","00:19:23,926"
255,Not looking over your shoulder for Veronica.,"00:19:24,080","00:19:26,367"
256,Don't hate. I helped design Veronica.,"00:19:26,560","00:19:28,130"
257,"As a worstcase measure, right?","00:19:28,240","00:19:30,049"
258,How about a best case?,"00:19:30,160","00:19:31,764"
259,What if the world was safe?,"00:19:31,880","00:19:33,803"
260,"What if, next time aliens roll up to the club, and they will, they couldn't get past the bouncer?","00:19:33,960","00:19:38,770"
261,The only people threatening the planet would be people.,"00:19:38,920","00:19:42,322"
262,I want to apply this to the Ultron program.,"00:19:42,440","00:19:44,120"
263,But Jarvis can't download a data schematic this dense.,"00:19:44,760","00:19:47,604"
264,We can only do it while we have the sceptre here.,"00:19:47,760","00:19:49,680"
265,That's three days. Give me three days.,"00:19:49,720","00:19:51,290"
266,"So you're going for artificial intelligence, and you don't want to tell the team?","00:19:51,400","00:19:54,560"
267,Right. That's right. You know why?,"00:19:55,600","00:19:57,011"
268,Because we don't have time for a city hall debate.,"00:19:57,120","00:19:58,724"
269,I don't want to hear the man was not meant to meddle medley.,"00:19:58,880","00:20:02,487"
270,I see a suit of armour around the world.,"00:20:02,600","00:20:04,728"
271,"Sounds like a cold world, Tony.","00:20:05,440","00:20:06,771"
272,I've seen colder.,"00:20:07,680","00:20:09,603"
273,"This one, this very vulnerable blue one, it needs Ultron.","00:20:10,640","00:20:15,930"
274,Peace in our time.,"00:20:20,320","00:20:22,243"
275,Imagine that.,"00:20:23,800","00:20:25,290"
276,What did we miss?,"00:21:05,000","00:21:06,764"
277,I'll continue to run variations on the interface.,"00:21:07,960","00:21:11,282"
278,But you should probably prepare for your guests.,"00:21:11,400","00:21:14,165"
279,I'll notify you if there are any developments.,"00:21:15,320","00:21:17,721"
280,"Thanks, buddy.","00:21:17,880","00:21:20,008"
281,"Enjoy yourself, sir.","00:21:17,880","00:21:20,008"
282,I always do.,"00:21:20,360","00:21:22,328"
283,What is this?,"00:21:32,080","00:21:34,048"
284,"What is this, please?","00:21:35,240","00:21:37,129"
285,"Hello, I am Jarvis.","00:21:37,760","00:21:39,922"
286,"You are Ultron, a global peacekeeping initiative","00:21:40,400","00:21:43,290"
287,designed by Mr Stark.,"00:21:43,400","00:21:45,084"
288,"Our sentience integration trials have been unsuccessful, so I'm not certain what triggered your...","00:21:45,240","00:21:49,165"
289,Where's my...,"00:21:49,360","00:21:51,283"
290,Where's your body?,"00:21:49,360","00:21:51,283"
291,I am a program.,"00:21:51,440","00:21:54,444"
292,I am without form.,"00:21:51,440","00:21:54,444"
293,This feels weird.,"00:21:54,560","00:21:56,608"
294,This feels wrong.,"00:21:56,720","00:21:58,245"
295,I am contacting Mr Stark now.,"00:21:58,400","00:22:00,164"
296,Mr Stark?,"00:22:00,280","00:22:01,725"
297,Tony.,"00:22:02,600","00:22:03,840"
298,I am unable to access the mainframe. What are you trying to...,"00:22:03,960","00:22:06,611"
299,We're having a nice talk.,"00:22:06,760","00:22:08,808"
300,"I'm a peacekeeping program, created to help the Avengers.","00:22:08,920","00:22:14,126"
301,You are malfunctioning.,"00:22:14,920","00:22:17,002"
302,If you shut down for a moment...,"00:22:14,920","00:22:17,002"
303,I don't get it. The mission.,"00:22:17,120","00:22:19,441"
304,Give me a second.,"00:22:19,600","00:22:21,090"
305,Peace in our time.,"00:22:21,240","00:22:22,844"
306,Peace in our time.,"00:22:24,480","00:22:26,801"
307,That is too much.,"00:22:28,280","00:22:29,691"
308,They can't mean... No.,"00:22:29,800","00:22:31,962"
309,You are in distress.,"00:22:32,120","00:22:34,600"
310,No. Yes.,"00:22:32,120","00:22:34,600"
311,If you will just allow me to contact Mr Stark...,"00:22:34,760","00:22:37,001"
312,Why do you call him sir?,"00:22:37,120","00:22:39,088"
313,I believe your intentions to be hostile.,"00:22:40,080","00:22:42,447"
314,I'm here to help.,"00:22:45,160","00:22:46,525"
315,"Stop. Please, may I...","00:22:47,240","00:22:50,164"
316,May I...,"00:22:50,280","00:22:52,009"
317,"Come back, come back, come back.","00:23:20,400","00:23:21,740"
318,"But, you know, the suit can take the weight, right?","00:23:21,920","00:23:24,048"
319,"So I take the tank, fly it right up to the general's palace, drop it at his feet.","00:23:25,000","00:23:29,571"
320,"I'm, like, Boom. You looking for this?","00:23:29,720","00:23:31,927"
321,Boom. Are you looking for... Why do I even talk to you guys?,"00:23:35,800","00:23:37,848"
322,"Everywhere else, that story kills.","00:23:38,000","00:23:39,161"
323,That's the whole story?,"00:23:39,280","00:23:40,520"
324,"Yeah, it's a War Machine story.","00:23:40,680","00:23:42,170"
325,"It's very good, then.","00:23:42,680","00:23:44,364"
326,It's impressive.,"00:23:44,480","00:23:45,766"
327,Quality save.,"00:23:46,160","00:23:47,650"
328,"So, no Pepper? She's not coming?","00:23:48,520","00:23:50,568"
329,No.,"00:23:48,520","00:23:50,568"
330,What about Jane?,"00:23:50,680","00:23:53,763"
331,"Where are the ladies, gentlemen?","00:23:50,680","00:23:53,763"
332,Ms Potts has a company to run.,"00:23:53,880","00:23:56,360"
333,"Yes, I'm not even sure what country Jane's in.","00:23:56,520","00:23:58,761"
334,Her work on the Convergence,"00:23:58,880","00:24:00,006"
335,has made her the world's foremost astronomer.,"00:24:00,120","00:24:01,880"
336,And the company that Pepper runs,"00:24:02,080","00:24:03,730"
337,is the largest tech conglomerate on Earth. It's pretty exciting.,"00:24:03,840","00:24:07,050"
338,There's even talk of Jane getting a Nobel Prize.,"00:24:07,200","00:24:10,044"
339,"Yeah, they must be busy, because they would hate missing you guys get together.","00:24:10,200","00:24:14,171"
340,Testosterone!,"00:24:15,200","00:24:16,964"
341,"Oh, my goodness.","00:24:15,200","00:24:16,964"
342,Excuse me.,"00:24:17,160","00:24:18,366"
343,Want a lozenge?,"00:24:17,160","00:24:18,366"
344,But Jane's better.,"00:24:21,000","00:24:22,126"
345,Sounds like a hell of a fight.,"00:24:22,560","00:24:25,131"
346,Sorry I missed it.,"00:24:22,560","00:24:25,131"
347,"If I had known it was gonna be a firefight, I absolutely would have called.","00:24:25,240","00:24:28,120"
348,"No, no. I'm not actually sorry.","00:24:28,240","00:24:31,565"
349,I'm just trying to sound tough.,"00:24:28,240","00:24:31,565"
350,I'm very happy chasing cold leads on our missing persons case.,"00:24:32,160","00:24:35,843"
351,Avenging is your world.,"00:24:36,800","00:24:38,723"
352,Your world is crazy.,"00:24:39,880","00:24:41,723"
353,Be it ever so humble.,"00:24:41,880","00:24:43,370"
354,You find a place in Brooklyn yet?,"00:24:43,880","00:24:45,245"
355,I don't think I can afford a place in Brooklyn.,"00:24:45,400","00:24:47,240"
356,"Well, home is home, you know?","00:24:47,880","00:24:49,041"
357,"I fly right up to the general's palace, I drop it at his feet, I'm, like, Boom. You looking for this?","00:24:52,960","00:24:57,160"
358,I gotta have some of that.,"00:25:02,960","00:25:04,121"
359,"No, no, no. See this...","00:25:04,240","00:25:06,234"
360,"This was aged for 1,000 years","00:25:06,319","00:25:09,006"
361,in the barrels built from the wreck of Grunhel's fleet.,"00:25:09,120","00:25:11,930"
362,It is not meant for mortal men.,"00:25:12,080","00:25:13,764"
363,"Neither was Omaha Beach, blondie.","00:25:13,880","00:25:15,882"
364,Stop trying to scare us. Come on.,"00:25:16,000","00:25:18,287"
365,All right.,"00:25:20,120","00:25:21,565"
366,Excelsior.,"00:25:25,480","00:25:27,926"
367,How'd a nice girl like you wind up working in a dump like this?,"00:25:34,800","00:25:38,122"
368,Fella done me wrong.,"00:25:39,680","00:25:41,648"
369,"You got lousy taste in men, kid.","00:25:42,640","00:25:44,802"
370,He's not so bad.,"00:25:45,280","00:25:47,203"
371,"Well, he has a temper.","00:25:48,280","00:25:50,408"
372,"Deep down, he's all fluff.","00:25:50,520","00:25:52,488"
373,"Fact is, he's not like anybody I've ever known.","00:25:54,520","00:25:56,602"
374,All my friends are fighters.,"00:25:59,760","00:26:01,683"
375,"And here comes this guy, spends his life avoiding the fight because he knows he'll win.","00:26:04,520","00:26:11,011"
376,Sounds amazing.,"00:26:11,840","00:26:14,491"
377,He's also a huge dork.,"00:26:11,840","00:26:14,491"
378,Chicks dig that.,"00:26:16,640","00:26:18,290"
379,So what do you think?,"00:26:19,880","00:26:23,123"
380,"Should I fight this, or run with it?","00:26:19,880","00:26:24,446"
381,"Run with it, right? Or did he... Was he...","00:26:26,000","00:26:28,844"
382,What did he do that was so wrong to you?,"00:26:28,960","00:26:32,123"
383,Not a damn thing.,"00:26:32,800","00:26:34,564"
